{
  "$schema": "../catalog.schema.json",
  "catalogVersion": "1.0.0",
  "name": "Academia Espronceda scheduling rules",
  "description": "Language-neutral scheduling rules and preferences shared by NestJS validation and the Python solver.",
  "scoring": {
    "direction": "MINIMIZE",
    "comparison": "LEXICOGRAPHIC",
    "bestScore": 0,
    "priorityOrder": [
      {
        "priority": 1,
        "name": "Avoid classes above maximum capacity",
        "ruleIds": ["CLASS_CAPACITY_MAXIMUM"]
      },
      {
        "priority": 2,
        "name": "Avoid classes below minimum capacity",
        "ruleIds": ["CLASS_CAPACITY_MINIMUM"]
      },
      {
        "priority": 3,
        "name": "Keep active classes at the ideal capacity",
        "ruleIds": ["CLASS_CAPACITY_IDEAL"]
      },
      {
        "priority": 4,
        "name": "Spread a student's hours across different weekdays",
        "ruleIds": ["STUDENT_DAY_SPREAD"]
      },
      {
        "priority": 5,
        "name": "Place related students together",
        "ruleIds": ["RELATED_STUDENTS_TOGETHER"]
      },
      {
        "priority": 6,
        "name": "Use the preferred teaching profile",
        "ruleIds": ["PREFERRED_TEACHER_BACH1_SCIENCES", "PREFERRED_TEACHER_OTHER_SCIENCES"]
      }
    ]
  },
  "rules": [
    {
      "id": "ACTIVE_STUDENTS_ONLY",
      "name": "Only active students can be scheduled",
      "description": "Every scheduled student must be active; waiting-list people cannot receive assignments.",
      "classification": "RULE",
      "enforcement": "HARD",
      "severity": "ERROR",
      "priority": null,
      "condition": "Every assignment references a student whose status is ACTIVE.",
      "entities": ["SCHEDULE", "ASSIGNMENT", "STUDENT"],
      "evidence": ["scheduleId", "assignmentId", "studentId", "studentStatus"],
      "appliesTo": [
        "SOLVER_STRICT",
        "SOLVER_RELAXED",
        "DRAFT_VALIDATION",
        "CONFIRMATION",
        "GENERATED_SCHEDULE_VALIDATION"
      ],
      "parameters": {},
      "optimization": null
    },
    {
      "id": "CLASS_SLOT_VALID",
      "name": "Classes use valid one-hour slots",
      "description": "Every class must reference one predefined weekday slot inside the weekly opening calendar.",
      "classification": "RULE",
      "enforcement": "HARD",
      "severity": "ERROR",
      "priority": null,
      "condition": "Every class references an input slot whose duration is exactly sixty minutes and whose day is Monday through Friday.",
      "entities": ["SCHEDULE", "CLASS", "SLOT"],
      "evidence": ["scheduleId", "classId", "slotId", "dayOfWeek", "startTime", "endTime"],
      "appliesTo": [
        "SOLVER_STRICT",
        "SOLVER_RELAXED",
        "DRAFT_VALIDATION",
        "CONFIRMATION",
        "GENERATED_SCHEDULE_VALIDATION"
      ],
      "parameters": {
        "durationMinutes": 60,
        "timezone": "Europe/Madrid"
      },
      "optimization": null
    },
    {
      "id": "TEACHER_SINGLE_CLASS_PER_SLOT",
      "name": "A teacher has at most one class per slot",
      "description": "A teacher cannot lead parallel classes in the same weekly slot.",
      "classification": "RULE",
      "enforcement": "HARD",
      "severity": "ERROR",
      "priority": null,
      "condition": "The pair teacherId and slotId is unique among classes in a schedule.",
      "entities": ["SCHEDULE", "CLASS", "TEACHER", "SLOT"],
      "evidence": ["scheduleId", "classIds", "teacherId", "slotId"],
      "appliesTo": [
        "SOLVER_STRICT",
        "SOLVER_RELAXED",
        "DRAFT_VALIDATION",
        "CONFIRMATION",
        "GENERATED_SCHEDULE_VALIDATION"
      ],
      "parameters": {},
      "optimization": null
    },
    {
      "id": "STUDENT_UNIQUE_IN_CLASS",
      "name": "A student appears once in a class",
      "description": "A class cannot contain duplicate assignments for the same student.",
      "classification": "RULE",
      "enforcement": "HARD",
      "severity": "ERROR",
      "priority": null,
      "condition": "Each studentId occurs at most once in the assignments of a class.",
      "entities": ["CLASS", "ASSIGNMENT", "STUDENT"],
      "evidence": ["classId", "assignmentIds", "studentId"],
      "appliesTo": [
        "SOLVER_STRICT",
        "SOLVER_RELAXED",
        "DRAFT_VALIDATION",
        "CONFIRMATION",
        "GENERATED_SCHEDULE_VALIDATION"
      ],
      "parameters": {},
      "optimization": null
    },
    {
      "id": "STUDENT_TIME_OVERLAP",
      "name": "A student cannot attend overlapping classes",
      "description": "A student cannot be assigned to two or more classes that overlap on the same day, regardless of teacher.",
      "classification": "RULE",
      "enforcement": "HARD",
      "severity": "ERROR",
      "priority": null,
      "condition": "For every student, no pair of assigned class intervals overlaps on the same weekday; adjacent intervals are not overlaps.",
      "entities": ["SCHEDULE", "CLASS", "ASSIGNMENT", "STUDENT", "TEACHER", "SLOT"],
      "evidence": ["scheduleId", "studentId", "classIds", "teacherIds", "slotIds"],
      "appliesTo": [
        "SOLVER_STRICT",
        "SOLVER_RELAXED",
        "DRAFT_VALIDATION",
        "CONFIRMATION",
        "GENERATED_SCHEDULE_VALIDATION"
      ],
      "parameters": {},
      "optimization": null
    },
    {
      "id": "STUDENT_SAME_DAY_CONTIGUOUS",
      "name": "Same-day classes must be consecutive",
      "description": "A student cannot have two or more classes on the same weekday unless those classes occupy consecutive one-hour slots, so the student does not leave and return later that day.",
      "classification": "RULE",
      "enforcement": "HARD",
      "severity": "ERROR",
      "priority": null,
      "condition": "For every student and weekday, the assigned slots on that day form a contiguous block: after sorting by startTime, each slot's endTime equals the next slot's startTime.",
      "entities": ["SCHEDULE", "CLASS", "ASSIGNMENT", "STUDENT", "SLOT"],
      "evidence": ["scheduleId", "studentId", "dayOfWeek", "classIds", "slotIds"],
      "appliesTo": [
        "SOLVER_STRICT",
        "SOLVER_RELAXED",
        "DRAFT_VALIDATION",
        "CONFIRMATION",
        "GENERATED_SCHEDULE_VALIDATION"
      ],
      "parameters": {},
      "optimization": null
    },
    {
      "id": "TEACHER_SUBJECT_COMPATIBILITY",
      "name": "Teacher and subject compatibility",
      "description": "Every assigned student must have at least one contracted subject supported by the teacher, and any explicit subject allocation must use a supported subject.",
      "classification": "RULE",
      "enforcement": "HARD",
      "severity": "ERROR",
      "priority": null,
      "condition": "The teacher supports at least one of the student's subjects and supports every subject explicitly allocated to that teacher.",
      "entities": ["ASSIGNMENT", "STUDENT", "TEACHER", "SUBJECT"],
      "evidence": [
        "assignmentId",
        "studentId",
        "teacherId",
        "studentSubjectCodes",
        "teacherSubjectCodes"
      ],
      "appliesTo": [
        "SOLVER_STRICT",
        "SOLVER_RELAXED",
        "DRAFT_VALIDATION",
        "CONFIRMATION",
        "GENERATED_SCHEDULE_VALIDATION"
      ],
      "parameters": {},
      "optimization": null
    },
    {
      "id": "TEACHER_COURSE_COMPATIBILITY",
      "name": "Teacher and course compatibility",
      "description": "Every assigned student's course must be supported by the teacher.",
      "classification": "RULE",
      "enforcement": "HARD",
      "severity": "ERROR",
      "priority": null,
      "condition": "The student's course code occurs in the teacher's supported course codes.",
      "entities": ["ASSIGNMENT", "STUDENT", "TEACHER", "COURSE"],
      "evidence": [
        "assignmentId",
        "studentId",
        "teacherId",
        "studentCourseCode",
        "teacherCourseCodes"
      ],
      "appliesTo": [
        "SOLVER_STRICT",
        "SOLVER_RELAXED",
        "DRAFT_VALIDATION",
        "CONFIRMATION",
        "GENERATED_SCHEDULE_VALIDATION"
      ],
      "parameters": {},
      "optimization": null
    },
    {
      "id": "TEACHER_AVAILABILITY",
      "name": "Teacher availability",
      "description": "A class can only use a slot in which its teacher is available.",
      "classification": "RULE",
      "enforcement": "HARD",
      "severity": "ERROR",
      "priority": null,
      "condition": "The class slotId occurs in the teacher's availableSlotIds.",
      "entities": ["CLASS", "TEACHER", "SLOT"],
      "evidence": ["classId", "teacherId", "slotId", "teacherAvailableSlotIds"],
      "appliesTo": [
        "SOLVER_STRICT",
        "SOLVER_RELAXED",
        "DRAFT_VALIDATION",
        "CONFIRMATION",
        "GENERATED_SCHEDULE_VALIDATION"
      ],
      "parameters": {},
      "optimization": null
    },
    {
      "id": "TEACHER_WORKING_SLOT_OCCUPIED",
      "name": "Teacher working slots stay occupied",
      "description": "When generating a schedule, every teacher working slot that can receive at least one compatible available student must contain a class with students. This invariant is hard in both strict and relaxed search and cannot be confirmed away.",
      "classification": "RULE",
      "enforcement": "HARD",
      "severity": "ERROR",
      "priority": null,
      "condition": "For every teacherId and availableSlotId pair that has at least one feasible student assignment, the generated schedule contains a class with one or more studentIds.",
      "entities": ["SCHEDULE", "CLASS", "TEACHER", "SLOT", "STUDENT"],
      "evidence": ["scheduleId", "teacherId", "slotId", "classId", "studentIds"],
      "appliesTo": ["SOLVER_STRICT", "SOLVER_RELAXED", "GENERATED_SCHEDULE_VALIDATION"],
      "parameters": {},
      "optimization": null
    },
    {
      "id": "STUDENT_AVAILABILITY",
      "name": "Student availability",